{
  "schema": "enki-content-ledger/v1",
  "timezone": "Europe/Madrid",
  "generated_at": "2026-08-30T08:00:00+02:00",
  "coverage": {
    "period_start": "2026-01-01T00:00:00+01:00",
    "period_end": "2026-08-30T08:00:00+02:00",
    "status": "partial",
    "sources": [
      {"source": "paperclip", "status": "ok", "as_of": "2026-08-30T08:00:00+02:00"},
      {"source": "wordpress", "status": "ok", "as_of": "2026-08-30T07:55:00+02:00"},
      {"source": "instagram", "status": "unavailable", "as_of": null},
      {"source": "facebook", "status": "unavailable", "as_of": null}
    ],
    "warnings": ["Social history is not connected; duplicate detection is incomplete."]
  },
  "entries": [
    {
      "record_id": "blog:demo-123",
      "channel": "blog",
      "status": "published",
      "title": "Demo de guía de compra",
      "published_at": "2026-08-20T10:00:00+02:00",
      "canonical_url": "https://www.example.invalid/blog/demo-guia-compra/",
      "external_id": "demo-123",
      "topic_cluster": "guia-de-compra",
      "products": ["SKU-DEMO-1"],
      "categories": ["categoria-demo"],
      "campaign": null,
      "source": "wordpress",
      "last_verified_at": "2026-08-30T07:55:00+02:00"
    }
  ]
}
